"","control_id","control","IG1","IG2","IG3","section_id","recommendation_id","view_level","title","pivot_control_id","pivot_recommendation_id","url","assessment_status","applicable_profiles","description","rationale_statement","impact_statement","audit_procedure","remediation_procedure","default_value"
"34","6.8","Define and Maintain Role-Based Access Control","-","-","o","1874519","3690794","4.1.10","Minimize access to the proxy sub-resource of nodes","417","3690794","https://workbench.cisecurity.org/sections/1874519/recommendations/3690794","Manual","Level 1","Users with access to the Proxy sub-resource of Node objects automatically have permissions to use the Kubelet API, which may allow for privilege escalation or bypass cluster security controls such as audit logs.
The Kubelet provides an API which includes rights to execute commands in any container running on the node. Access to this API is covered by permissions to the main Kubernetes API via the node object. The proxy sub-resource specifically allows wide ranging access to the Kubelet API.
Direct access to the Kubelet API bypasses controls like audit logging (there is no audit log of Kubelet API access) and admission control.","The ability to use the proxy sub-resource of node objects opens up possibilities for privilege escalation and should be restricted, where possible.","","Review the users who have access to the proxy sub-resource of node objects in the Kubernetes API.","Where possible, remove access to the proxy sub-resource of node objects.",""
"35","6.8","Define and Maintain Role-Based Access Control","-","-","o","1874519","3690795","4.1.11","Minimize access to the approval sub-resource of certificatesigningrequests objects","417","3690795","https://workbench.cisecurity.org/sections/1874519/recommendations/3690795","Manual","Level 1","Users with access to the update the approval sub-resource of certificateaigningrequest objects can approve new client certificates for the Kubernetes API effectively allowing them to create new high-privileged user accounts.
This can allow for privilege escalation to full cluster administrator, depending on users configured in the cluster","The ability to update certificate signing requests should be limited.","","Review the users who have access to update the approval sub-resource of certificatesigningrequest objects in the Kubernetes API.","Where possible, remove access to the approval sub-resource of certificatesigningrequest objects.",""
"36","6.8","Define and Maintain Role-Based Access Control","-","-","o","1874519","3690796","4.1.12","Minimize access to webhook configuration objects","417","3690796","https://workbench.cisecurity.org/sections/1874519/recommendations/3690796","Manual","Level 1","Users with rights to create/modify/delete validatingwebhookconfigurations or mutatingwebhookconfigurations can control webhooks that can read any object admitted to the cluster, and in the case of mutating webhooks, also mutate admitted objects. This could allow for privilege escalation or disruption of the operation of the cluster.","The ability to manage webhook configuration should be limited","","Review the users who have access to validatingwebhookconfigurations or mutatingwebhookconfigurations objects in the Kubernetes API.","Where possible, remove access to the validatingwebhookconfigurations or mutatingwebhookconfigurations objects",""
"37","6.8","Define and Maintain Role-Based Access Control","-","-","o","1874519","3690797","4.1.13","Minimize access to the service account token creation","417","3690797","https://workbench.cisecurity.org/sections/1874519/recommendations/3690797","Manual","Level 1","Users with rights to create new service account tokens at a cluster level, can create long-lived privileged credentials in the cluster. This could allow for privilege escalation and persistent access to the cluster, even if the users account has been revoked.","The ability to create service account tokens should be limited.","","Review the users who have access to create the token sub-resource of serviceaccount objects in the Kubernetes API.","Where possible, remove access to the token sub-resource of serviceaccount objects.",""
"38","6.8","Define and Maintain Role-Based Access Control","-","-","o","1874533","3010629","5.8.1","Ensure authentication using Client Certificates is Disabled","417","3010629","https://workbench.cisecurity.org/sections/1874533/recommendations/3010629","Automated","Level 1","Disable Client Certificates, which require certificate rotation, for authentication. Instead, use another authentication method like OpenID Connect.","With Client Certificate authentication, a client presents a certificate that the API server verifies with the specified Certificate Authority. In GKE, Client Certificates are signed by the cluster root Certificate Authority. When retrieved, the Client Certificate is only base64 encoded and not encrypted.
GKE manages authentication via gcloud for you using the OpenID Connect token method, setting up the Kubernetes configuration, getting an access token, and keeping it up to date. This means Basic Authentication using static passwords and Client Certificate authentication, which both require additional management overhead of key management and rotation, are not necessary and should be disabled.
When Client Certificate authentication is disabled, you will still be able to authenticate to the cluster with other authentication methods, such as OpenID Connect tokens. See also Recommendation 6.8.1 to disable authentication using static passwords, known as Basic Authentication.","Users will no longer be able to authenticate with the pre-provisioned x509 certificate. You will have to configure and use alternate authentication mechanisms, such as OpenID Connect tokens.","The audit script for this recommendation utilizes 3 variables:
$CLUSTER_NAME
$COMPUTE_ZONE
Please set these parameters on the system where you will be executing your gcloud audit script or command.
Using Google Cloud Console

Go to Kubernetes Engine by visiting https://console.cloud.google.com/kubernetes/list
From the list of clusters, click on the desired cluster. On the Details pane, make sure 'Client certificate' is set to 'Disabled'.

Using Command line
To check that the client certificate has not been issued, run the following command:
gcloud container clusters describe $CLUSTER_NAME \
  --zone $COMPUTE_ZONE \
  --format json | jq '.masterAuth.clientKey'

The output of the above command returns null ({ }) if the client certificate has not been issued for the cluster (Client Certificate authentication is disabled).
Note.  Depreciated as of v1.19. For Basic Authentication, Legacy authorization can be edited for standard clusters but cannot be edited in Autopilot clusters.","Currently, there is no way to remove a client certificate from an existing cluster. Thus a new cluster must be created.
Using Google Cloud Console

Go to Kubernetes Engine by visiting https://console.cloud.google.com/kubernetes/list
Click CREATE CLUSTER
Configure as required and the click on 'Availability, networking, security, and additional features' section
Ensure that the 'Issue a client certificate' checkbox is not ticked
Click CREATE.

Using Command Line
Create a new cluster without a Client Certificate:
gcloud container clusters create [CLUSTER_NAME] \ 
 --no-issue-client-certificate","Clusters created from GKE version 1.12 have Basic Authentication and Client Certificate issuance disabled by default."
"39","6.8","Define and Maintain Role-Based Access Control","-","-","o","1874533","3010630","5.8.2","Manage Kubernetes RBAC users with Google Groups for GKE","417","3010630","https://workbench.cisecurity.org/sections/1874533/recommendations/3010630","Manual","Level 2","Cluster Administrators should leverage G Suite Groups and Cloud IAM to assign Kubernetes user roles to a collection of users, instead of to individual emails using only Cloud IAM.","On- and off-boarding users is often difficult to automate and prone to error. Using a single source of truth for user permissions via G Suite Groups reduces the number of locations that an individual must be off-boarded from, and prevents users gaining unique permissions sets that increase the cost of audit.","When migrating to using security groups, an audit of RoleBindings and ClusterRoleBindings is required to ensure all users of the cluster are managed using the new groups and not individually.
When managing RoleBindings and ClusterRoleBindings, be wary of inadvertently removing bindings required by service accounts.","Using G Suite Admin Console and Google Cloud Console

Navigate to manage G Suite Groups in the Google Admin console at: https://admin.google.com/dashboard
Ensure there is a group named gke-security-groups@[yourdomain.com]. The group must be named exactly gke-security-groups.
Ensure only further groups (not individual users) are included in the gke-security-groups group as members.
Go to the Kubernetes Engine by visiting: https://console.cloud.google.com/kubernetes/list.
From the list of clusters, click on the desired cluster. In the Details pane, make sure Google Groups for RBAC is set to Enabled.","Follow the G Suite Groups instructions at: https://cloud.google.com/kubernetes-engine/docs/how-to/role-based-access-control#google-groups-for-gke.
Then, create a cluster with:
gcloud container clusters create <cluster_name> --security-group <security_group_name>

Finally create Roles, ClusterRoles, RoleBindings, and ClusterRoleBindings that reference the G Suite Groups.","Google Groups for GKE is disabled by default."
"40","6.8","Define and Maintain Role-Based Access Control","-","-","o","1874533","3010631","5.8.3","Ensure Legacy Authorization (ABAC) is Disabled","417","3010631","https://workbench.cisecurity.org/sections/1874533/recommendations/3010631","Automated","Level 1","Legacy Authorization, also known as Attribute-Based Access Control (ABAC) has been superseded by Role-Based Access Control (RBAC) and is not under active development.
RBAC is the recommended way to manage permissions in Kubernetes.","In Kubernetes, RBAC is used to grant permissions to resources at the cluster and namespace level. RBAC allows the definition of roles with rules containing a set of permissions, whilst the legacy authorizer (ABAC) in Kubernetes Engine grants broad, statically defined permissions. As RBAC provides significant security advantages over ABAC, it is recommended option for access control. Where possible, legacy authorization must be disabled for GKE clusters.","Once the cluster has the legacy authorizer disabled, the user must be granted the ability to create authorization roles using RBAC to ensure that the role-based access control permissions take effect.","Using Google Cloud Console:

Go to Kubernetes Engine by visiting: https://console.cloud.google.com/kubernetes/list.
From the list of clusters, click on each cluster to open the Details pane, and make sure 'Legacy Authorization' is set to 'Disabled'.

Using Command Line:
To check Legacy Authorization status for an existing cluster, run the following command:
gcloud container clusters describe <cluster_name> --zone <compute_zone> --format json | jq '.legacyAbac'

The output should return null ({}) if Legacy Authorization is Disabled. If Legacy Authorization is Enabled, the above command will return true value.","Using Google Cloud Console:

Go to Kubernetes Engine by visiting: https://console.cloud.google.com/kubernetes/list.
Select Kubernetes clusters for which Legacy Authorization is enabled.
Click EDIT.
Set 'Legacy Authorization' to 'Disabled'.
Click SAVE.

Using Command Line:
To disable Legacy Authorization for an existing cluster, run the following command:
gcloud container clusters update <cluster_name> --zone <compute_zone> --no-enable-legacy-authorization","Kubernetes Engine clusters running GKE version 1.8 and later disable the legacy authorization system by default, and thus role-based access control permissions take effect with no special action required."
"41","7.3","Perform Automated Operating System Patch Management","o","o","o","1874530","3010613","5.5.3","Ensure Node Auto-Upgrade is enabled for GKE nodes","421","3010613","https://workbench.cisecurity.org/sections/1874530/recommendations/3010613","Automated","Level 1","Node auto-upgrade keeps nodes at the current Kubernetes and OS security patch level to mitigate known vulnerabilities.","Node auto-upgrade helps you keep the nodes in the cluster or node pool up to date with the latest stable patch version of Kubernetes as well as the underlying node operating system. Node auto-upgrade uses the same update mechanism as manual node upgrades.
Node pools with node auto-upgrade enabled are automatically scheduled for upgrades when a new stable Kubernetes version becomes available. When the upgrade is performed, the Node pool is upgraded to match the current cluster master version. From a security perspective, this has the benefit of applying security updates automatically to the Kubernetes Engine when security fixes are released.","Enabling node auto-upgrade does not cause the nodes to upgrade immediately. Automatic upgrades occur at regular intervals at the discretion of the Kubernetes Engine team.
To prevent upgrades occurring during a peak period for the cluster, a maintenance window should be defined. A maintenance window is a four-hour timeframe that can be chosen, during which automatic upgrades should occur. Upgrades can occur on any day of the week, and at any time within the timeframe. To prevent upgrades from occurring during certain dates, a maintenance exclusion should be defined. A maintenance exclusion can span multiple days.","Using Google Cloud Console

Go to Kubernetes Engine by visiting: https://console.cloud.google.com/kubernetes/list
From the list of clusters, select the desired cluster. For each Node pool, view the Node pool Details pane and ensure that under the 'Management' heading, 'Auto-upgrade' is set to 'Enabled'.

Using Command Line
To check the existence of node auto-upgrade for an existing cluster's Node pool, run:
gcloud container node-pools describe <node_pool_name> --cluster <cluster_name> --zone <cluster_zone> --format json | jq '.management'

Ensure the output of the above command has JSON key attribute autoUpgrade set to true:
{
  ""autoUpgrade"": true
}

If node auto-upgrade is disabled, the output of the above command output will not contain the autoUpgrade entry.","Using Google Cloud Console

Go to Kubernetes Engine by visiting: https://console.cloud.google.com/kubernetes/list.
Select the Kubernetes cluster containing the node pool for which auto-upgrade disabled.
Select the Node pool by clicking on the name of the pool.
Navigate to the Node pool details pane and click EDIT.
Under the Management heading, check the Enable auto-repair box.
Click SAVE.
Repeat steps 2-6 for every cluster and node pool with auto-upgrade disabled.

Using Command Line
To enable node auto-upgrade for an existing cluster's Node pool, run the following command:
gcloud container node-pools update <node_pool_name> --cluster <cluster_name> --zone <cluster_zone> --enable-autoupgrade","Node auto-upgrade is enabled by default.
Even if a cluster has been created with node auto-repair enabled, this only applies to the default Node pool. Subsequent node pools do not have node auto-upgrade enabled by default."
"42","7.4","Perform Automated Application Patch Management","o","o","o","1874530","3010614","5.5.4","When creating New Clusters - Automate GKE version management using Release Channels","422","3010614","https://workbench.cisecurity.org/sections/1874530/recommendations/3010614","Manual","Level 1","Subscribe to the Regular or Stable Release Channel to automate version upgrades to the GKE cluster and to reduce version management complexity to the number of features and level of stability required.","Release Channels signal a graduating level of stability and production-readiness. These are based on observed performance of GKE clusters running that version and represent experience and confidence in the cluster version.
The Regular release channel upgrades every few weeks and is for production users who need features not yet offered in the Stable channel. These versions have passed internal validation, but don't have enough historical data to guarantee their stability. Known issues generally have known workarounds.
The Stable release channel upgrades every few months and is for production users who need stability above all else, and for whom frequent upgrades are too risky. These versions have passed internal validation and have been shown to be stable and reliable in production, based on the observed performance of those clusters.
Critical security patches are delivered to all release channels.","Once release channels are enabled on a cluster, they cannot be disabled. To stop using release channels, the cluster must be recreated without the --release-channel flag.
Node auto-upgrade is enabled (and cannot be disabled), so the cluster is updated automatically from releases available in the chosen release channel.","Using Google Cloud Console:

Go to Kubernetes Engine by visiting: https://console.cloud.google.com/kubernetes/list.
From the list of clusters, select the desired cluster.
Within the Details pane, if using a release channel, the release channel should be set to the Regular or Stable channel.

Using Command Line:
Run the following command:
gcloud beta container clusters describe <cluster_name> --zone <cluster_zone> --format json | jq .releaseChannel.channel

The output of the above command will return regular or stable if these release channels are being used to manage automatic upgrades for the cluster.","Currently, cluster Release Channels are only configurable at cluster provisioning time.
Using Google Cloud Console:

Go to Kubernetes Engine by visiting: https://console.cloud.google.com/kubernetes/list.
Click CREATE, and choose CONFIGURE for the required cluster mode.
Under the Control plane version heading, click the Release Channels button.
Select the Regular or Stable channels from the Release Channel drop-down menu.
Configure the rest of the cluster settings as required.
Click CREATE.

Using Command Line:
Create a new cluster by running the following command:
gcloud container clusters create <cluster_name> --zone <cluster_zone> --release-channel <release_channel>

where <release_channel> is stable or regular, according to requirements.","Currently, release channels are not enabled by default."
"43","7.5","Perform Automated Vulnerability Scans of Internal Enterprise Assets","-","o","o","1874530","3010616","5.5.6","Ensure Integrity Monitoring for Shielded GKE Nodes is Enabled","423","3010616","https://workbench.cisecurity.org/sections/1874530/recommendations/3010616","Automated","Level 1","Enable Integrity Monitoring for Shielded GKE Nodes to be notified of inconsistencies during the node boot sequence.","Integrity Monitoring provides active alerting for Shielded GKE nodes which allows administrators to respond to integrity failures and prevent compromised nodes from being deployed into the cluster.","None.","Using Google Cloud Console:

Go to Kubernetes Engine by visiting: https://console.cloud.google.com/kubernetes/list
From the list of clusters, click on the name of the cluster under test.
Open the Details pane for each Node pool within the cluster, and ensure that 'Integrity monitoring' is set to 'Enabled' under the Security heading.

Using Command Line:
To check if Integrity Monitoring is enabled for the Node pools in the cluster, run the following command for each Node pool:
gcloud container node-pools describe <node_pool_name> --cluster <cluster_name> --zone <compute_zone> --format json | jq .config.shieldedInstanceConfig

This will return the following, if Integrity Monitoring is enabled:
{
   ""enableIntegrityMonitoring"": true
}","Once a Node pool is provisioned, it cannot be updated to enable Integrity Monitoring. New Node pools must be created within the cluster with Integrity Monitoring enabled.
Using Google Cloud Console

Go to Kubernetes Engine by visiting: https://console.cloud.google.com/kubernetes/list
From the list of clusters, click on the cluster requiring the update and click ADD NODE POOL.
Ensure that the 'Integrity monitoring' checkbox is checked under the 'Shielded options' Heading.
Click SAVE.

Workloads from existing non-conforming Node pools will need to be migrated to the newly created Node pool, then delete non-conforming Node pools to complete the remediation
Using Command Line
To create a Node pool within the cluster with Integrity Monitoring enabled, run the following command:
gcloud container node-pools create <node_pool_name> --cluster <cluster_name> --zone <compute_zone> --shielded-integrity-monitoring

Workloads from existing non-conforming Node pools will need to be migrated to the newly created Node pool, then delete non-conforming Node pools to complete the remediation","Integrity Monitoring is disabled by default on GKE clusters. Integrity Monitoring is enabled by default for Shielded GKE Nodes; however, if Secure Boot is enabled at creation time, Integrity Monitoring is disabled."
"44","7.5","Perform Automated Vulnerability Scans of Internal Enterprise Assets","-","o","o","1874530","3010617","5.5.7","Ensure Secure Boot for Shielded GKE Nodes is Enabled","423","3010617","https://workbench.cisecurity.org/sections/1874530/recommendations/3010617","Automated","Level 2","Enable Secure Boot for Shielded GKE Nodes to verify the digital signature of node boot components.","An attacker may seek to alter boot components to persist malware or root kits during system initialisation. Secure Boot helps ensure that the system only runs authentic software by verifying the digital signature of all boot components, and halting the boot process if signature verification fails.","Secure Boot will not permit the use of third-party unsigned kernel modules.","Using Google Cloud Console:

Go to Kubernetes Engine by visiting: https://console.cloud.google.com/kubernetes/list.
From the list of clusters, click on the name of the cluster under test.
Open the Details pane for each Node pool within the cluster, and ensure that Secure boot is set to Enabled under the Security heading.

Using Command Line:
To check if Secure Boot is enabled for the Node pools in the cluster, run the following command for each Node pool:
gcloud container node-pools describe <node_pool_name> --cluster <cluster_name> --zone <compute_zone> --format json | jq .config.shieldedInstanceConfig

This will return the value below, if Secure Boot is enabled:
{
  ""enableSecureBoot"": true
}","Once a Node pool is provisioned, it cannot be updated to enable Secure Boot. New Node pools must be created within the cluster with Secure Boot enabled.
Using Google Cloud Console:

Go to Kubernetes Engine by visiting: https://console.cloud.google.com/kubernetes/list
From the list of clusters, click on the cluster requiring the update and click ADD NODE POOL.
Ensure that the Secure boot checkbox is checked under the Shielded options Heading.
Click SAVE.

Workloads will need to be migrated from existing non-conforming Node pools to the newly created Node pool, then delete the non-conforming pools.
Using Command Line:
To create a Node pool within the cluster with Secure Boot enabled, run the following command:
gcloud container node-pools create <node_pool_name> --cluster <cluster_name> --zone <compute_zone> --shielded-secure-boot

Workloads will need to be migrated from existing non-conforming Node pools to the newly created Node pool, then delete the non-conforming pools.","By default, Secure Boot is disabled in GKE clusters. By default, Secure Boot is disabled when Shielded GKE Nodes is enabled."
